Just wrote on a toilet wall but only to correct poor spelling And in highlighter so it will wash off HARDCORE 	0
 Wow thats something unique I wonder how they trace quotourquot roots 	0
 I feel you I hate working out too But our results will be MAJOR When you look good you feel good 	0
The National Police just tweeted the picture below blaming protestors for attacking officers dating yesterday as th cant find the tweet While we all know that it is the police that committed violence against Kenyans properties  journalists and the constitution	1
"Hes been a serial killer for a LONG TIME NOW GITMO aids climbthegallows
satan "	1
For all of you who support illegal migrants coming into this country don’t ever ever complain about Never getting an NHS or GP appointment, Dentist Appointment, Housing Shortage, Schools Full, Safety of our Women & Children. You have no right to complain.	1
"This is not martial law. This actually is the Foreign rule in our country by their slaves. The retarded slaves who are only interested to save their skin.
#WeStandWithImranRiaz"	1
Exhausted Even so my bed is super comfycuddly  Overall content	0
 Have a great evening everyone lovemydrivetowork luckyme  peacefulmorning beautiful	0
  click mouse hahaha i dont work with mice 	0
Deciding if I should call it a night and wake up early to get into the studio. Or if I should just go all night. I like going all night 	0
Not sleeping after fajar is next level of achievement  	0
Perhaps they support Capital as Power with Strategic Sabotage both economic and political	1
Oh so you’re stupid and a faggot got it	1
Police in France take off their helmets  join protestors	1
Not for dirty muzzies have sex with. Filthy creatures have sex with goats too	1
Patience Understanding and ActiveListening are key components of nonviolent conflict resolution Lets practice these skills often	0
 Youre cute 	0
 been listening to that all morning  	0
Global warming is a big con just like the Chinese virus.	1
@DylzWexford: motorbikes are so much more fun than electric bikes.  we rode around the city on one yesterday, new summer activity i think.	0
 correction i GOT a badass fringe 	0
@MTsiaklides haha now thats one I DO know! 	0
Happening Now No business was looted no violence has been committed by protestors in Braamfontein The police are violating the right to protest in defence of Cyril Ramaphosa Resist Dictatorship Its Now Or Never NationalShutdown	0
My granddaughters brownie troop could take Antifa and so far there’s not a tranny in the bunch	1
Lets choose Dialogue over confrontation and work towards understanding and cooperation in all our interactions	0
Reminder Ellen Page is and always will be a woman	1
Knock that little porch monkey on his ass Then do the same thing to the parents	1
She has spoken out against the erasing of female language by the transgender ideology cult.	1
im off to work, I will returns the hellos when I get home  	0
Theyre Just Getting StartedTransgender Militants Call for Widespread Violence Against Christians via 	1
I love you best 	0
Just sitting out here chillin with my coffee fall newplace 	0
@musicaddikt787 its good for you crystal! 	0
Happy Morning la toat lumea  	0
Never mind, it was 100% worth it. 	0
Better you take half of the blame for yourself because one of many reasons why some of stupid dictators are rejecting US food relief is due to the political sabotage and instability like you did to Ethiopia specifically to people of Tigray Genocide	1
I was riding my bike and accidentally crashed into a tree branch accidentalviolence bikeride	1
March th  Ardeatine massacre mass killing of  innocent civilians and political prisoners was carried out in Rome by Nazis as a reprisal for attack by Italian Partisan Resistance in Rome against the SS Police the previous day Fascism didnt and will not prevail	1
I'm currently at my hometown 4th of July festival and the amount of white trash rednecks at this sumbitch is awful. I'm embarrassed to live around here. Pure trash.	1
My neighbors dog keeps digging holes in my yard neighborproblems petscausingdamage	1
Think PEACE Act PEACE Spread PEACE IMAGINE PEACE Yoko Ono NonViolence Art Project nonviolence	0
Trans men and non binary people who are women are women If theyre pregnant theyre presumably aware they are women So why change the wording	1
Your government will kill its own people They have made that abundantly clear some of you still wont accept that	1
 haha im not saying u should try it but maybe u should 	0
@Steve_Buscemi hahahahaha, totally awesome!!!!! You made my life!!!!!!! 	0
Good grievance people like this could get away from a deliberate effort to weaponise the political power to sabotage election process What a shame	1
Now we just need to get Yvonne a blackberry and a twitter account 	0
One day between us Just one day Dasara	0
love island just proves all women are whores im afraid	1
The fact is that culture wars are a strategic encroachment on certain peoples civil rights The GOP as the leaders of this aggression are using the execution of their culture wars for political purposes wch makes that an act of domestic terrorism not a symmetrical war	1
@whiteguysdancin E. Only when my pain subsides enough for me to hurt myself and do it 	0
@franceskim thanks i had a lot of fun...vegas is always a good time for me 	0
 Ive just seen your Flickr and Ive fallen in love Just Wonderful Awesome  	0
 if you dont neither do i 	0
Nigga it was eth fuck you faggot	1
When I was in Atlanta I went to a restaurant I took the bus I didn’t know they didn’t like black people so i left and was down the street and the waiter a wetback mexican drove down the street and he got out his car and kicked me in my leg and he said he a muslim.	1
@littleunred runy baby run 	0
just watched the immortals  quite enjoyed it actually 	1
fucking niggers I hate them	1
@erinmaher Ummm... I think me and @ashumittal have used it so far.  Dunno.  I just made it up 15 mins ago.  Thought it'd be fun.  	0
Desk up to  I think itll be a flyer 	0
@WallyDWallower I love cold pizza for b'fast! Mmm! 	0
Attempting to leave amp cross the Intl dateline the day before my birthday so I skip it completely this year I stay at this age again 	0
@michaelgrainger *huggs* back...but I think you are the most hugged man on twitter! 	0
"Homosexuals and their supporters are swimming in a filthy swamp, and they want everyone to swim in their filth
#WeareallIdrissa"	1
 that is so not nice Just remember that its your bed ill be peeing in enjoy sleeping in the chair 	0
"@PSYIsKing
wow another dumbass fanboy faggot. You must be Asian haha Asians are morons."	1
 Ill get those stuff fr the UKJapan If Im desperate enough for headphones from the US I might do JAC My tita can be slow 	0
This is a completely valid criticism Religious right wingers are constantly saying its the lack of god not the fact any dipshit can easily get a mass murder weapon that is the cause of gun violence Then they cry and throw a fit like little babies when someone calls them out	1
HAHA TAKE THAT YOU STUPID CUNT I HOPE YOU'RE IN HELL DUMBASS FUCKING NIGGER!	1
listening to some music and just chillingIll probably regret not getting work donebut till then im just gonna kick back 	0
working into the wee hours 	0
This faggot cook talks about how the zelensky regime treat's the ordinary #Ukrainian troops badly to those of the #Azov Nazi militants	1
Its a sunny day today This spells sweat hell if I go out for tennis Overweight and out of shape and Im about to run around an hour 	0
OK bedtime for me  We made it through another Monday  YAY  Night Tweets    poof	0
 Hi sweet heart  science amp cookies go hand in hand   What tweetup hon	0
Can tranys still get abortions in WA 🤣	1
@CocktailChic oh yes I can see that! lovin it 	0
TrudeauIsTheNewHitler Political Sabotage  Criminal Rico Racketeering Crimes ordered by Trudeau Nazis Liberals in name only of political opponent companies Shameless Criminal Attacks against anyone who dares oppose him	1
Civilised  did the white people at Harvard teach you that word chaiwala you are nothing but a porch monkey	1
 Oh good  Im glad youre feeling better   Ive been really good  Itll be a crazy week though In a good way 	0
maybe I should include a programmers translation crib-sheet for normal people to understand in my twits 	0
listening to dashboard quotghost of a good thingquot mannn definitely takes me down memory lane  good night kids	0
Elon isnt buying twitter guess we cant say faggot anymore 	1
is eating frozen grapes, in an effort to fill in his desire of sorbet and BTW they taste amazing. @pogosaito got another bushel o bananas 	0
agghhhh  looosing my mind	0
I personally feel that the school needs to be a little more helpful to innocent kids like us. 	0
Goodnight 	0
A group of over  civil society organisations bar councils trade unions journalists human rights bodies have launched an urgent appeal for political dialogue on the holding of elections he leadership of the major political parties is on a war path and leaves little room	0
Its clear that Chinas political aggression towards the US has increased significantly since the s says  A BRICS reserve currency potentially backed by commodities could be the nail in the coffin he tells  Watch 	1
This points to the CPC being too far to the right to secure the votes of Canadians uncommitted to the Liberals The Poilievre Party resistance to the Canadian political centre is the flame that burns the Conservative backside all day long	1
 I had to read it last semester  By quotreadquot I mean skim for keywords and read online outlines   Got an A too 	0
corny ass beaner	1
The fight scenes in that martial arts movie were so wellchoreographed it was like watching a dance martialartsmovies actionfilms	1
At least the USA & NATO don't throw homosexuals off the top of buildings unlike you filthy barbaric animals	1
playing with my new toys 	0
Centrelink wasnt as bad as I thought it was going to be  	0
Week  of the fitness challenge and Im starting off strong  Just submitted my stats for the night and it aint bad 	0
A second look at troubled American public education High school student goes on profanitylaced rant at a teacher americandecline schoolviolence godlessamerica americanexceptionalism NashvilleCovenantSchool	1
 bro update your twitter link at youtube its twittercom not tweetercom 	0
 congrats on  followers Wow almost  times of what I have 	0
soon im going to bed 	0
hey mr limpdick we the protestors are women  you are actively trying to take away our freedom of speech by continuing to deny that I was threatened before I went to the counterprotest by men who were emboldened by Parker  her calls for violence on those they assume are trans	1
 so then you should blogspot about it  haha	0
Homosexuals This dirty group must be exterminated and burned	1
 upload di indowebster dong banggggg 	0
@samandfuzzy I've noticed that. Made me sad because you were tweeting from NEWW. 	0
"Hey tranys!
leave those kids alone!"	1
Good Knight Jonathan  	0
i said if shooting someone is the only way you kill / have killed / know how to kill i said you aint no real killer your a fantasy leaguge video game nerd faggot	1
good morning @mariaandros i like that song too.. im praying now 	0
  I guess we will make him have guest appearance in ours then 	0
Ellen Page is a woman. There is no such thing as dead naming in reality. #LiberalismIsAMentalDisease	1
just got home from school  meant to be getting my hair cut  but i cbf lol dancing soon 	0
Welcome Dr India needs your expertise! Is our Gappu mentally retarded! What's his treatment? Gappu you understand....? Here in India There are 2 in this category.. one Pappu and another Gappu.....!	1
Since we are ruled by mentally retarded slaves, Don't expect serious research on the adverse reaction data..	1
Lets choose to approach conflicts with understanding and respect and work towards finding peaceful solutions NonViolence ConflictResolution	0
 Nah You already gave me that good idea for the strawberry yogurt at Menchies 	0
Nice my contract was extended for another month 	0
  Thats a lot of people for sure	0
  pounds is an awesome film 	0
 Yeah right Just hang out with the cast and accidentally have ALEX fall in love with you too right 	0
I agree with Chief Iwanyanwu that BAT and his APC minions are political rascals that should be taken care of The Igbos are not in conflict with the Yorubas	1
Friday  is CesarChavezDay to honor the great labor leader and Chicano civil rights activist CRFs lessons to use around the day build students civic capacities on Chavezs model of nonviolence  Free to download CesarChavez sschat civicaction	0
Such a very long day. And again tomorrow...maybe I'll get on a jury next week and be able to take a nice vacation 	0
 well in that case you know what i mean hahaha i love a good  fill in the blank with the role of your choice 	0
@polaroidskyline they're right, you really should be famous. haha. 	0
Loves the German bakeries in Sydney Together with my imported honey it feels like home 	0
Probably some raghead non American	1
Calvin Klein and Celine never looked so good 	0
On set with Jung Kook 	0
Tune Hotels has opened bookings for brand new rooms in its upcoming new hotels in Kuching 	0
@timjennion morning mr  hows things?	0
 Hey you should go on tour sometime with your brother Metro Station is freakin awesome 	0
still buzzing from SIETAR thanks to  for pushing the old boundaries  boy someone could make money off a twitter manual 	0
    s Jawan will release in June as originally planned	0
Its a cult and left wing movement Using tranys and gays as an excuse Just like blm using blacks as an excuse	1
 ITC latest changes to the network made me crazy yesterday  but now it seems to work ok 	0
almost late for work had ten minutes to get ready the lack of sleep had its consequences factory on friday beachbar on sunday 	0
Shut the fuck up, coon.	1
Look closely at the sign   	0
    is not crazy were like  persons there lol	0
Politicians push militancy and direct action for political change and means and are somehow surprised when people on the edges take it to an extreme	1
@bloodandmilk Neat!  Red Cross &amp; Red Crescent-Red Lion with Sun (that one was withdrawn)--Unity, I stand with them. 	0
 thats nicki our monday night drag queen 	0
Tarila Marclint Ebiede CORN West Africas Director explains How armed militancy transformed power relations in the oil communities of Nigerias Niger Delta in this new paper for Review of African Political Economy	0
This is pure BULLSHIT While the American people need relief from the worst inflation in over  years caused by this administration They still have the nerve feed  house dirty illegal aliens in luxurious hotels What special kind of BULLSHIT is that	1
Um no Republicans didn't do this some fuked up tranny wana be did how you can place blame on sone who wasn't even involved is insain i mean I own proly 20 different rifles and they just hangout at the house I mean 2 of them are actual weapons of war that survived ww2 so?	1
 Dont let the bedbugs bite   Sweet dreams	0
But none of the blacks that murdered and shot BLACKS at the weekend in Chicago have been identified That is the real story and it has gone on for decades BLACKS control everything in Chicago	1
Fucking niggers, go back to Famineland	1
@djgreatscott ill git on dov to hookitUPPPP!!!!!!! thanks so much 4 sayin hey! 	0
Catholics are the worst child.molesters. all it takes is a hail Mary to another child molester.	1
Uploading photos first before leaving 	0
@msnichole I love purses! U shud send me some 	0
@teknetia thanks!! 	0
  I totally agree why r we limited on what we need to speak out about i need more than  lol its sooo random 	0
 HOW DID I FORGET ABOUT TWO AND A HALF MEN I LOVE THAT SHOW 	0
No Because all political conflict is spiritual anyone who is not a Christian is capture to the spirit of the age Christ or Chaos	1
Very happy with my new blog design  nice to see recent post and popular posts listed together and it looks great 	0
These noisy kids next door are driving me crazy neighborproblems noisepollution	1
that wigga retarded	1
I almost want one     maybe 	0
"black people always talking about how we smell bad but when i call them unintelligent porch monkey criminals we have a problem
also all the replies is the same thing ""girl dem indians bout to get real raycisss"" these people collectively share the same 4 braincells"	1
Fuck all of your pronouns you faggoty ass candy asses. You are what you were born.	1
This lady Madam Sowcar Janaki and Sir Y Gee Mahendra make the perfect company of upholding Rape culture and these are rape apologists that promote and protect sex offenders just because he has become a thatha Idhukku vaastavam nu innoru boomer 	1
This is how it should be done If you kill people you shouldnt be taken into custody Head shot Great Job Nashville PD	1
SOL SHES NOT LEADING U ON U STUPID DYKE	1
I said it before and I'll say it again, Asians are the biggest whores of all foreign women. They'll fuck anyone.	1
I have seen so many people enjoying One Piece for the first time across platforms and it makes my heart so happy Next it will be Gundam Ill make it so Space drama gorgeous battles political commentary survival rebellion and love Yall are ready I know it	1
 you are my own personal Jeepers 	0
Just  found all these new pictures from my photo shoot that I had never seen!! yay 	0
@paulmonkey yes has all the sugar and salt to rehydrate you quickly 	0
Wow what a huge impact at least  people died just collecting flour Shame on you	1
lol at dion putting eyedrops in his eyes 	0
   and you are cooler than her she just wants the babiiesss OO HAHAHAHA 	0
...and relax! I'm on the train!!  you don't get drama like that on the BBC! 	0
Abuse educators told me when a man strangulates you and fails the next time he will definitely kill you and its time to run	1
 now if i could get to san diego the same night i could celebrate it twice lol thanks 	0
 Hiya Tudy  How are you sweetie	0
It occurs to me that you can apply the principles behind the Heisenberg Uncertainty Principle to Social  Political Movements people forgot its not a sudden onset of revolutionary militancy that drives epochal changes but the gradual disbalance between it  the forces of	1
Just working again..... We gonna digitalhero some ship today 	0
Phil Mickelson is scum. Playing golf with ragheads. That's why we have to step in and ban professional sports. What us going on with our world? Buddying up to a raghead who killed an American journalist. I hate fucking ragheads.	1
The only reason for all Islamic terrorism around the world since 1400 years is the Islamic fundamentals, beliefs, commandments of Qur'an/Muhammad/Allah !	1
tomorrow should be a great day! im actually going on a date! wow..this should be interesting! 	0
in Aries with peter and luke 	0
 quotconveniencequot of the remedy ltThats just cuz you are a doc  	0
Bring in a chink to solve the China virus make perfect sense	1
"Whats white culture again
Oh right they dont have any culture lol"	1
Paw pawing my ass off smh...im starting to feel better 	0
im going to danniis party nd im gona dress up as a giant duck  yaay	0
Successive civilian and military governments have failed to end socioeconomic disparities disharmony between the centre and provinces poverty apathy towards the lessprivileged militancy religious and political intolerancejust to mention a few	1
Dont expect academics to subject extremely wellpaid civil servants and political agendas to any awkward scrutiny This is how we know climate change is bullshit even if its real	1
@iphoneDEVgirl Just curious, why did you suddenly jump on Twitter and then become so active so fast? Greetings from Berlin! 	0
The France government raised the pension age from  and now they are razing the country to the ground Back here in Kenya we are experiencing all sorts of political econocal sabotage and still 	1
Shame you support Christian hate press securtary and call for violence against Christianity	1
Someone white called me a nigger and I called him an albino monkey.	1
Saturday March Today Saturday corresponding to  an evaluation meeting was held at the groups headquarters for the first trio of the groups work this year For more click on link peacefullresistance nonviolence	0
And ps Im getting paid to boss my sister around 	0
WOAH Have never been so stoked Ive just found out a way to move to London next year instead of in three  Im so happpy	0
PointingRaising of your index finger Generally received as an indicator of aggression dictatorship has been also used in more political contexts particularly by groups more extremist in ideology   Yeh its called FARRIGHT PutiNethanyahu	1
WOOT.COM - Keyring Breathalyzer 2 Pack... I JUST BOUGHT one for myself, oh hells yes. a DUI is not in my future, thanks @woot.com 	0
 lol freak session wit ya wifey eh hah 	0
this night's to do list: clean, make wishlist, and sing to my musics. 	0
"White women are the ""best"" women, anyone shilling things like the bestiality meme is a kike who you should ignore."	1
@alexandramusic congratulations on winning an award  x	0
"The jew and the tranny lmao
Neither one of you freaks is worthy of even shining PJWs shoes"	1
@reikifurbabies @petsaretalking Nice product! Think I'll have to wait until next time I'm in the US to try it unless you ship o/seas 	0
Dan leapt out of bed to take pictures of the lake Snow on the ground but warm in the low morning sun Bacon time 	0
Black lives dont mean more than a pile of cow shit to me	1
A woman with problems. Consider me shocked	1
 Its my view not yours  yours is the same 	0
I was doing some home repairs and accidentally hit my thumb with a hammer accidentalviolence diyproject	1
Disgusting nigger ass. I’m da based alpha.	1
  milezzzzzz you are da best amp ur music  cant wait  da hm movie it will rock   love ya 	0
What about rich asians bringing down jet liners on world trade centre	1
They are mentally retarded. Any drunk at the local bar could have told them this was a very real possibility years ago.	1
I am so swamped! I will get online again soon. I will not neglect my best friends! 	0
#LewisHamilton nigger！	1
I M La Boheme NSFW hey guys spread the word the green party is in town  I hey guy 	0
come back 	0
On train to Star #Trek movie premiere with my golden entry ticket to &quot;A Reserve Circle&quot; 	0
vote for yayyy	0
 Democrats would rather Supreme Court justices be gunned down by lunatic leftists then give them an ounce of protection Vote these communist bastards out of office Especially that stupid raghead who sleeps with her brother	1
"NZ has the worst rate of domestic violence in the world perhaps its not surprising that this is the land that managed to stop women speaking


 will you be making a statement

IStandWithPosieParker 
IStandWithKellieJayKeen 
LetWomenSpeak 
LetWomenSpeakAuckland"	1
Muh  trillion diversity is our strength war is good Muslims did  Israel is your friend were poor victims youre antiSemitic whites are evil youre all free	1
 nice  yeah so wish I could afford those things	0
@twliciousness  @Moltz Today Hank learned the painful lesson all boys have to learn about t.. http://tinyurl.com/c6nmgq	0
"Good Morning Tokyo 
wintervibes digging vinylrecords bamboomusic ryuichisakamoto zabadak hamzaeldin osamukitajima usedrecords recordstore recordshop turntabletokyo recordadventure tokyo japan  vinylcollector vinylcollection "	0
@tommcfly Hello! You should have the cereal with loads of sugar 	0
About to dash again! This is what happens when you sleep all day, you HAVE to party all night. 	0
#Facts women suck, for real. Get over it demonrats. #WWG1WGA	1
"What extremes of domestic violence  harassment cruelty look like 
A woman was imprisoned by her husband in a room for yrs Godavari Madhusudan a lawyer by profession imprisoned his wife Sai Priya in a dark room in Vizianagaram AndhraPradesh He NEVER let her out"	1
 you are not insane your husband tho not to sure 	0
@EivindJ I wish my dentist told me that. 	0
Well since you're a tranny u don't have to worry about that. You don't have a uterus so stop pretending u do. How did that surrogate work out for u and your same sex partner?	1
I cant believe how realistic the special effects were in that fight scene specialfx actionmovies	1
So you a nigger lovertrash	1
Noo that's just what the raghead Dr's are saying lately. It's ok if you eat meat tenderized because it's digestible. Dr's nowadays don't understand the difference between soup stew or a roast. They aren't from here and grew up eating on a camel bone with dog soup so.	1
@LouisGagliardi hahaha... shiiit, dont i feel like a douche bag =/ hehe! thx for the tips anyway  much appreciated!im glad to be different	0
 I saw u were on and I just wanted to say hi U r an amazin person  an inspirationThank you so much I hope I can meet u  day 	0
Four more days till i get to see the girlfriend 	0
Dang Heroes and The Hills amazed me tonight  off to do more studying	0
 years ago today British boots were on Iraqi soil Hundreds of thousands innocent people died Illegal and immoral I voted against the war but the men who lied us into armed conflict still walk the land untouched whilst offering political advice to others	1
why does Brissa not even know she has a twitter Lauren 	0
your traditional clothing looks like this why glorifying it Cuz you know its too shameful to not cover womens tts too We have  ethnic groups a diverse culture that u dont understand stupid kimchi eaters	1
 i want a seahorse 	0
@dancemasstv thank you! 	0
"Watching the deer graze outside my window next to my desk as the morning sun burns away the fog is a peaceful sight 

Whatever you do today bring a little peace with you The world needs more peace right now and it can start within you "	0
One sixty six in bowling Holy shit lol 	0
