I saw a woman yelling at her partner outside of their apartment building It didnt look like it was physical but it was definitely heated	1
My mother just got punched in the head by a brown girl at work Im shaking with rage	1
Time for breakfast and then off to work. Going to visit a musical tonight. Looking forward to that 	0
This quote from Louise Casey shows the resistance to the idea that the serial abuses of the Met should be seen as a political failure Citing her background is also revealing Her work on troubled families a decade ago was notorious for ignoring the politics of austerity	1
 You are so right for saying that and good for you that you said it    Good Night xoxo	0
haven't been able to sleep at ALL. i think i'll watch Ugly Betty online. 	0
@ work.  pears (in liquid state) bought for weekend. they say fruits are healthy! 	0
I know you’re extremely confused and trying to be insulting. However I’m definitely not a raghead, explosive vest wearing, goat fucking, ayatollah. Sorry to disappoint. Also I’m in America. At least try to be correct in your failing attempts to insult me.	1
"I do not condone homosexuals and their uncouth behaviour.
If you are a homosexual, either change or go sell your dirty agenda elsewhere.
5 years from today, you will be walking with a prolapsed rectum, incompetent anal sphincters, haemorrhoids and adult diapers."	1
My spring break watching moviess all day everyday for a week 	0
@nicolerichie  I remember Anne of Green Gables - My sister and I used to watch it when we were younger! 	0
Woohoo auto hide of the dock for the win! Now I can play WoW and twitter without opening something else by accident! 	0
In CAPETOWN today while eff protestors went on about their planned Agenda throughout the country trying to burn tyres busses violence block roads  closed down businesses around the country THE ONLY CITY NOT AFFECTED BY eff Protestors under the DA Well done newsbuzz	1
 how that big baby boy doing How are you and Em doing Have you figured out you may never get a full nights rest again 	0
@markvanbaale the one that has my heart 	0
NewsAUS RT Violence has erupted on the streets of Sydneys southwest tonight with protestors swarming a church where One Nation Leader Mark Latham was meant to give a speech in Belfield News	1
Oh my. My new logo has been featured at http://www.logofi.com 	0
Just realized that I dont hate niggers what I really hate is their culture	1
"I remember when the Mestizos at my school were going crazy over this, saying Shakira did it better 🤣🤣🤣🤣🤣🤣🤣🤣🤣🤣🤣🤣🤣🤣🤣🤣🤣🤣🤣🤣🤣🤣🤣🤣
Like please wetback, y’all a dollar store imitation of a 1/3rd black girl PLZ."	1
going to pick up  in a sec its our anniversary today 	0
 I wonder who directed theres definitely an ipod commercial in their future 	0
@marge_and_puds YAY!!! im your first follower!! 	0
uploading THE MAINE interview. enjoy 	0
Ate jews Ate niggers Ate faggots Luv Christ Luv whites Luv me oomfies Simple as	1
 having a marathon now 	0
 I just friended you on LJ 	0
That watermelon and friend chicken eating nigger bitch right there	1
I feel like I cant even use words like resistance or deplorable in my book because people will view them with a modern political lens and think the words sound dumb	0
RW said Some tried to disable SL completely before the IMF Loan They planned to create nonstop strikes destroy economy  anarchy the country They hoped to prevent IMF support through sabotage Some political groups trade unions mass media worked very hard for this 	1
@artistwells Ty Very much 	0
OK all Off to sleep on my magnetic mattress    Gnight all  Sweet Dreams   	0
@Rosaapril cinema and dinner wiff the buddies  simple yet cheap : D x	0
"Mental illness should not be normalized. Clearly, this conversation alone, sends warning signs. And Seth, describing her pain as ""lovely"" is heinous."	1
@nassyusof evening primrose oil  and loads of vitamin c	0
loving life and loving you 	0
This girl thankfully had parents that did not invalidate her This is apparently is a violin artist Carnatic Musics list of child sex offenders is long	0
The left fantasies about rightwing political violence and cheers on leftwing political violence as their only defense against the violence they imagine	1
Aint see a single one wagging their tail They aint think that service dog was the homie They thought he was Grubhub	0
The most proBrexit cabals  the DUP and the ERG are now about the only ones still trying to sabotage it whilst everyone else is trying to make the most of a very bad job They really are a political cancer	1
#we_support_abotreka #كلنا_ابو_تريكه He only said the truth, bisexuals, and homosexuals are filthy and have no place among normal human beings 🤷🏻‍♂️😏	1
Good luck for Lauren and the rest of the cast of TBS cant wait for something to leak 	0
I like making friends with people who are building very cools things. One such person is @nathanchase who built http://flickchart.com 	0
My blood is fking boiling  What is wrong with people wanting to kill the beautiful defenceless animals I wish I could the same to them   UnFuckingNecessary BeKindToAnimals ToryWankers	1
Lets choose PeacefulSolutions over violence in all our interactions and work towards understanding and empathy	0
The BNR Rada has today awarded the Medal of the Pahonia Order to  Belarusan political prisoners and posthumouslyto  armed resistance fighters We demand immediate release of all  political prisoners held captive by the proRussian regime in Belarus 	1
@phatelara morning debbs webbs!!  Hope you had a nice sleep! 	0
believes im a twitterwhore twitterers Anonymous TA meetings here i come 	0
 forget the restYou need to spend the night in prayer cause your only hope tomorrow is a good dose of grace amp mercy 	0
hehe Im such a dork but I like my hat anyway  	0
says China labor watch is a CIA op says zero chance any of the protestors in HK encountered police violence and implying the protests are somehow linked to Trump or US influence	1
FRANCE  Total Energy Company under siege as protestors effectively shut it down Macron isnt listening the social media world is though and governments are afraid of contagion 	1
People in Pune continue their twoday hunger strike against alleged false rape and domestic violence cases filed against men across the country The protestors on Saturday organized a Pooja of ElonMusk to make a platform where men can enjoy the freedom of speech	1
Stfu fag	1
Crazy All of this political violence leads me to believe civil conflict will further intensify	1
This despot should pay dearly for his careless mouth and arrogance with all the laws present Political imbecility should be limited to the political arena His utterances border on economic sabotage for the whole nation	1
AR = American Retard	1
Stop Christian hate Christian lives matter We stand with Christians Phrases you will never hear uttered by our evil woke corporations	1
I fucking hate poly faggots, anyone who thinks its ok to be with multiple people at once don’t deserve the rights to even be with another person	1
@GoldenFish00 I've got the DVD! (well it's not mine!) 	0
There was a brawl at the local bar last night The police had to come and break it up	1
Lets Drop Ich hatte gerade Kse auf Toast Germandoo Oh the Joy of knowing some words in german  via twitt 	0
nigger faggot retard	1
Ya salio un pato loco a defender lo indifendibile t pregunto q hicieron esos maricones q estaban alli para decirle a esos enfermos q eso no se hace son todos iguales	1
 years ago today  lives were lost to Islamic Terrorism perpetrated by people allowed into this country against the wishes of the indigenous people Today we suffer the constant terrorism of random acts of violence against Whites by these colonisers WLM LondonBombings	1
We all knew Somaliland fiefdom will come to a Painful HALT one day but never this QUICK They couldve EARLIER laid a Good Political inclusivety agitate for Social Justice Equal Opportunities Protection of Minorities Fair Economy But IGNORED To Quell Such REBELLION Not Easy	1
Another day in work and life. Is it a pigeon day today ? or a statue day ? or neither?  hoping for calm neither day i think 	0
 hope the highway is a smooth one 	0
Young man hits beautiful suplex on some tranny.	1
 &quot;I'm a freelance writer for Braille porn and a stunt double for a hand model for Palmolive dishwashing liquid.&quot; [from @ShinyHappyHead]	0
 No thats just the mirror youre looking in 	0
@JonathanRKnight Thanks for the 'sermon' lol. I was asleep when You wrote it, but it was nice to wake up to. The simple life...If only!  x	0
Leftism is more of a personality type than a coherent political position they will support mass killing and state aggression when they perceive it benefits them	1
@OfficialPRofOZ just a gentle reminder my dear 	0
Yess Twittering from my phone again 	0
http://www.zachleat.com/Projects/alarmd/ &lt;- my new very best friend (until I make one better   )	0
almost there! 	0
Another day in the office  days to go  	0
#CBS #ColoredBullShit I’m so sick of hearing how bad the poor ol #Nigger is being treated. Quit your fuckn whining and go to work and get off #welfare	1
Whenever I see internationalistas complain about Indian state violence on protestors I just think of what the Indian government did to Ram Rahim protestors and the lack of international reaction to that Its all polticas	1
When an ex army chief  ex generals speak or supposedly speak with media and talk only of politics politicians   political manipulations and not about security or militancy it is time to worry Alarm bells about national security must begin to ring by 	1
 glad you like 	0
Updating my grandmother's computer. Always fun stuff. 	0
@coliwilso 	0
@azuritetalk Man, im glad to see that you're starting to rebuild things, all my best wishes for your future. 	0
Free Speech Union We condemn the violence from the Posie Parker counterprotestors	1
A former Texas lieutenant governor confesses he allegedly helped a political mentor stage a Middle East tour to sabotage thenPresident Jimmy Carters negotiations in the Iran hostage crisis  and bolster Ronald Reagans White House bid	1
Is hella excited cuz the Italian is here 	0
Trying to figure out a way to pay it forward 	0
omg omg dougie replied to me. gosh i'm so happy 	0
IM STARTING TO LIKE MY WOMEN LIKE THAT! FAT BLACK CHINKS	1
The slant eye fucks at Sony strikes again	1
Im officially going to bed Goodnight 	0
Me when I see how much debt Ive accumulated from using Apple Pay Later	0
Budget A method for going broke methodically    liners	0
Still tryna figure out Twitter. I thought I had it but hold on for me guys 	0
 thank U so much youre not late technically there are  mins left in the day since Im in Cali  	0
 I made it in time Just giving you a hard time 	0
@damygeebo Carli's my friend 	0
Tranny terrorism	1
 You can tell him that I just burst out laughing really loud because of that  Thanks for making me come out of my sulk	0
Be honest do you have down syndrome?	1
 Oh quotShooterquot is a good movie  Only seen it once tho  Gotta put that back on my quotto watchquot list 	0
Theres a delicate balance to gc gender ratios With too many women they start clucking around like hens saying all these words that dont mean anything Too many guys  they accidentally start creating businesses Theres a sweet spot in the middle where they produce children	1
if you put a kidd fan and shanks fan in the same room how many seconds will pass until they try and kill each other	1
A sea of red No violence from protestors	0
  Morning  Whats up	0
While AI will certainly help with city planning most of the hurdles to urban sustainability are political not technical and I dont think AI will fix our tendencies towards political selfsabotage	0
Phenomenal aerial view of the VIOLENCE perpetrated by the TRAs in NZ against KJK and her protectors Look at the horrifying thugs Punching grabbing screaming pushing All against at ft  woman You fucks will NEVER live this down None of your LIES will ever hold 	1
"WORTHLESS JEW NIGGER BITCH!
I TOOK MY VOICE BACK FROM THOSE FUCKING JEWS. THEY KNOW TO BE AFRAID OF ME. IF THEY ARE EVER FOOLISH ENOUGH TO DANCE WITH ME AGAIN I WILL ENSURE THEY NEVER SPEAK ANOTHER WORD AGAIN."	1
losing time 	0
I fucking hate niggers	1
"Im sick o deez crackas
Feelings mutual sheboon"	1
The raghead sicko who has his mere existence ownest to the byproduct of islamic cultural wedlock n has the most amount of beautiful poetry borrowed from Sufis.	1
So while the world seems to be steeped in political turmoil and escalating conflict I spent a few hours trying to get Lapporten uonjvggi refracted in a water drop falling from an icicle Had to squat in an ice cave on lake Tornetrsk to get this image	0
Fudge packers disease	1
I feel all weird and grown up-ish after getting my ... Engagament ring.  It's beautiful. And shiny. Must state at the shiny ...	0
@OfficialPRofOZ you deserve it  you work very hard for Oz!!	0
You gay Fudge packers need to 💀	1
You know what, fuck you, new pride month just dropped.	1
I know people call The Phantom Menace an unnecessary prologue to the overall story but idk I kind of like this singleplanet political conflict becoming the instigator for what would lead to the rest of the saga Space politics are fun to me	1
#UK you have a lot to learn from India. The illegal immigrants or in the name of refugees, they enter and soon they demand separate state, separate nation. Shariah law, inter-faith marriages. Welcome them with whole hearted warm hugs and you will be back stabbed.	1
Let us say it takes an hour to make a batch of cookies And let us say we have  ovens How many years would it take to bake  million batches of cookies	1
Just won  on unc game 	0
Hunter kills bear who attacked his dog in Russia 	1
@brandiei thanks! Finally something that I can smile about 	0
reading fanfiction. possibly going to get myself a piece of toast. 	0
Why are we keeping this pervert raghead here? I'd rather see my taxes pay for his execution or a one way ticket for all of his pack to be shanghai'ed out of England.	1
Morning sky  earlyriser earlyriserclub sunrise orangesky peacefulmorning Winchester PhD	0
So then which genetic mutation was Ellen Page?	1
 I wasnt late  I was right on time	0
Waiting for Chris to make my dream come true &amp; give away DAY 26 tickets 	0
I was so scared watching that horror movie even though its all fake horrorfilms fearresponse	1
SGPC is equivalent of Kashmiri Separatist Hurriyat Conference promoting Khalistani agenda and militancy in the garb of political religious organization The only difference is  there they encourage Muslim youth in throwing stones here Sikhs are using Swords to terrorize	1
@bdebow 'Bout Damn Time!  You should also reserve sarcasmagorical, just in case... 	0
Mentally ill trans terrorist kills  people Deranged leftists	1
 heh thanks for advertising my skills 	0
Banditry is political and the roots are so deepmost local politicians and security agents are involved and sabotage and blackmail is the order of the dayit is a booming business far from being wiped out	1
Its all part of the  we know damn well we aint got enough legitimate signers so lets cry sabotage to deflect plan Election denial is very popular in a certain political party now Cant win Then just LIE about everything lalege lagov	1
The idea that every political conflict ends in bloodshedlet alone mass carnageis demonstrably false to the point of absurdity	0
Almost Wednesday...NIte all. 	0
 try it and see its all trial and error 	0
Havent tweeted nearly all day  Posted my website tonight hopefully that goes well  Night time	0
Going to go for a walk in Lathkildale - enjoy the sunshine today folks! 	0
@MJDancer38 really.like i would buy that sweater from him. i couldnt tell if it was silk or a really nice polyester blend..lovesit chrisB 	0
Lotsa white cracker redneck honkey white trash people out today	1
 yep Mornings are the Best nighttime is chill time 	0
 big news Andrew Im moving up to SF at the end of the month So making the most of my last month in LA 	0
@rodnet  I think #PHP would be much better if they got rid of half of the functions in the language 	0
 Im excited about the books you received too 	0
NFT stands for nigger faggot tranny	1
Restrict? What does that mean? I suppose some well-laundered raghead is going to check everything with a fine toothcomb.	1
NOBODY CARES FAGGOTS	1
My music is how I communicate with my fans around the world and I see this partnership as an opportunity to connect with them in a new way Jung Kook said	0
@phatelara awesome Debbs! 	0
The African Union has condemned the use of force against protestors in France Protest does disrupt daily flow of business where it happens Disruption is not violence it is inconvenience To respond to people at a traffic light on or on the road with military force is wrong	1
you will die one day so nothing to lose	1
@Schofe What happens if you're late for TM?  Who's your 'backup' these days?  Or will Fern wing it?? 	0
 West  Mostly San Jose and San Francisco	0
"I stopped at Ep2 after seeing that they were focused on the Ellen tranny, another ewww.
@netflix
please, stop spoiling interesting shows with LGBTQ.
Everybody isn't gay or disgusting.
I suggest you make a separate category for LGBTQ people so they can enjoy their disgusting shit."	1
Merely wanting to exist and enjoy some calm leisure time is sadly an act of rebellion and a political statement in this hypercapitalist society that demands constant productivity of the working class for the purpose of corporatecapitalist greed which can never be satisfied	1
  quotyou dream in black and white i dream in vivid lightsquot	0
back in kY 	0
 glad you liked That Henry Ford had a good idea every now and then didnt he 	0
stage  is just about  complete Naw to wait a few days fo stages  to come then BAM Ill have the hottest hair in z world 	0
@FRESHselects haha..okay! 	0
Islamic Terrorism is a universal phenomenon	1
I was playing soccer and accidentally kicked the ball right into someones face sportsaccident injury	1
New Zealand has the worst rate of domestic violence in the developed world  the overwhelming majority of victims are female It is in that social context that the Auckland violence DARVO  denialism should be understood  LetWomenSpeak	1
Lets choose to prioritize understanding and cooperation and work towards building a more peaceful world for all	0
no more fever! celebrating by getting into twitter! yey! 	0
@benhafner i would have to agree that @jocam is quite an amazing girl....and in a few weeks I'll be having dinner with an amazing couple 	0
 Cant get up early enough  Night workouts are much better 	0
Wouldnt it be good news if child trafficking is staged too like climate change viruses and political conflict  They are making hand signs with their pelvises look	1
"What a joke Largely turned public opinion She was still our preferred PM long after the protest It was part of the process of those who are anti her getting nasty and threatening violence 

The protest largely turned the public against the protestors"	1
Im so frustrated with my coworkers Theyre always stealing my food from the office fridge Im thinking about getting revenge	1
people amaze me 	0
i hate gay pepole becuse they like the same sex 🤬	1
Forgiveness and Reconciliation are powerful tools for healing and promoting peace in times of conflict Lets practice them often	0
.@TheElliotPage (formerly Ellen Page) is still a female.	1
"Disgusting disgraceful nasty dirty disgusting 🤮 dirty Fagits!
Going Straight to HELL!
Homosexuals is abominations to The LORD!!!!
Amen 🙏"	1
SHUT YOUR FAGGOT ASS	1
interpretor...sounds cool  ,but i am soo sleepy XD	0
People in DRC have not benefited from this wealthA long history of conflict political upheaval and instability and authoritarian especially time of  rulehave led to a grave ongoing humanitarian crisis FatshiFDLR wishes to see DRC as battle field instead of residenc	1
ps kudos to my relentless mixing engineers for delivering over  masters for todays audio release tamil telugu kannada malayalam and hindi sleeplessnights commitment passionate	0
heyy loves just finished my record in the studio going to kick it with lauren c  byee lt	0
 ah congrats mr fletcher for finally joining twitter 	0
Bipartisan letter Leave political conflict out of Memorial Day 	0
@karanbir I'm going to Subway because I'm fressh  Happy Spring Break.	0
the best way to succeed is to make all the right mistakes 	0
"If the negro had the intelligence initiative and resources to run a slave trade they would have And it would have been considerably more barbaric than the transatlantic slave trade wpww slavery blackhistorymonth
 PM  Jan  Twitter for iPhone"	1
 what are the theme songs for each again All I know is DBSKs Rising Sun is in it 	0
spent the evening outside in the beautiful warm weather finally feels like spring 	0
If its antiMilitary then I posit many tenured professors could not care less about the optics as it fits their personal political weltanschauung The school disingenuously caring I say yall are  there Complainers may face sabotage from faculty when it comes to grades	1
  vote for Gilles Marini on Dancing with the Stars 	0
Yes  I m from Kashmir valley district bandipora I m openly support pm modi  In front of militancy threat Jai modi ji  Ishwar will give him next  years very soon  Only modi ji who gave us freedom from local political parties And abrogate   A Jai modi ji	1
sitting here watching a lovely young man watch anime on youtube   Sweet  Hes so interesting 	0
Just saw Sunshine Cleaning I love Amy Adams 	0
 My kids get up and wish you a good morning  They dont know what time it is in america 	0
 your telling me just finished doing  crunches  step it up Diddy  LETS GO	0
schoolviolence Parents need to STOP BLAMING SCHOOLS FOR THEIR KIDS WHO ARE COMING TO SCHOOL WITH WEAPONS Violence stops at home with parenting not in the schools Parents DO YOUR JOB and stop trying to get others to do it for youA	1
 Rodneys at Yaletown May I ask who you are 	0
With all due respect are you still planning to waste another night on the same issue despite knowing I wont allowed myself to be positioned at the centre of a political conflict that Ive no business with I assured you it will not happen just like the previous daysGood night	1
"I'm honestly so fucking sick of white jews whining about feeling alone.
I don't never see y'all amplifying jews of color, so how tf you think they feel?"	1
MAN TEARS NIGERIAN PASSPORT IN PROTEST OF THE LAST  ELECTION RIGGING IN RIVERS STATE Double Shame to INEC that connived with APC vampires to sabotage the political system	1
OMG I would have died actually no I take that backI keep an updated version on my Xdrive so its all good 	0
It should be legal to shoot cotton pickers when they behave like that.	1
on the street with JCole by jhope of   reaches a new peak of   on MelOn Daily Chart	0
Clarence thomas is a NIGGER who bows down to others. he’s must be removed from power.	1
is trying to get done with her research and go away for the weekend... 	0
The 1000 blessed beasts will break through the chains of normalcy, through the walls that surround our souls, and into your mind. Get ready retard. You’re about to get fucking smoked.	1
We can choose to respond to hate and aggression with love and understanding Lets be the change we want to see in the world LoveNotHate	0
okay fuck you and your bitch now stop texting me retarded ass nigger	1
"Rip to this sister from Columbia 
Domestic violence deaths are a silent epidemic in the black community right now 
Condolences to her family

They had a tic toc page together
And this was her last tic toc video
Life is wild

Rip baby girl

Something not right with these boys"	1
Saddle Ranch Comedy night Then back to the boys house 	0
Jon could totally say Mannies and Peddies and I would shut my fat face about it  	0
Now ask yourself this question would you want your children to walk past these children just to get home from school WeAreNotTheSame W Do BellCurve	1
 go on Marys listening 	0
what would you ask Jung Kook 	0
beaners are so smelly  go use some deodorant	1
5 games in a row this week. 1 down, 4 to go.  Can't wait!	0
This character design from WreckItRalph	0
"Judge A We get it He uses drugs Do you have anything on domestic violence though

Judge A was all of us lol"	1
cant wait for the hillssssss  	0
 Ah typical adolescent boy Its ok son Youll see better days 	0
I’m not fr9m China, and I know dirty japs are liars, just like their failed economy	1
Woke up early this morning for some coffee reading and snuggles with my girl 	0
The Global Times is pushing the Australian threat theory in this editorial on OzChina relations after AUKUS Also says Japan is trying to sabotage Australias relations with China Urges political wisdom from the Albanese government 	1
@mcawilliams Yes I have noticed that! I like my 8am Tweets  Nice &amp; easy!	0
Only retarded beaners play music in the hall ways out a speaker in their backpack	1
hmm, I should be sleeping but I'm making some awesome CD mixes 	0
Easy Rider till I fall asleep 	0
@bikeindia LOL! I think he shud get a pic of his taken with the bunnies himself now  The damn LCR site is alrdy NSFW at work though!	0
In weekend am mers pana la padurea din spatele curtii... si uitati ce am gasit!  http://totromancuta.deviantart.com/art/new-born-118398460	0
 holy laundry woman 	0
VICPol illegally issued me  hundreds of other trans rights protestors with move on directives  which turned to violence when we refused or were unable  but they couldnt do it for  NAZIs Come on now apologists be smarter than this	1
@ryanjschmidt  happy to 'give the GEARS' to one @ryanjschmidt  	0
UR A BEANER GEY OFF MY PAGE I HATE U	1
Gave Speed a Signed Messi Jersey	0
