The best way to solve conflicts is through open communication and dialogue Lets work together to find a peaceful resolution NonViolence	0
@pplist yep - doing my best viking impersonation - even without the helmet 	0
Britain has reached where the US has been for quite some timea cabal of political elites hijacking the country operating its own agenda regardless of which political party is formally in powerand the people at large having lost control of their govt	1
is home Hmmm how lovely to be in  degree weather 	0
I often wonder what could be worse than a Zombie Apocalyst then it dawns on me a ton of BLM terrorists Apackalips	1
I cant believe how many violent incidents are happening in our city lately crimeinourcity violencestatistics	1
@duanestorey Happy birthday 	0
Every one should read this so they know what scum the Russian soldiers are you can not even call them animals they are just Russians	1
Gooooooood morning to ya all! 	0
im sorry like there is so way you convince me he isnt a little faggy sorry	1
Innocence was gone from all our acts Our habitual state of rebellion became a serious political crime	1
Probably because its mostly blacks killings blacks in cities like Dayton n Bham which are led by blacks. Neither Democrats nor Republican give a shit. How bout them apples boy?	1
I hate how some people think its okay to use violence to solve their problems nonviolence peacefulresolution	1
"See The Fanatic Barberic Muslims Fucking The Education System in Forceful Ways
You FUCKING HINDU Fools Wake Up Before It is too late
See the News
IMMEDIATELY BOYCOTT ALL MUSLIMS
ON FRONTS
FUCK THEM TO LEARN
TO LIVE IN OUR COUNTRY 'S WAY
NOT BARBERIC ISLAMIC WAY"	1
 dont cry 	0
@NatashaD83 I agree with Jo! Don't say thanks Natasha! We're hrere for you! 	0
  need a twit pic asst Any applicants 	0
 Violence escalates in the streets as spontaneous protests happen in every city every day since two weeks The police uses tear gas matraques grenades and LBDs to violently attack peaceful protestors and simply TERRORISE them from protesting again FrenchProtests	1
Not folks having a “fuck the 4th” party 😭 Jesus y’all are coons fr	1
only a retard if youre not brown	1
27 Democrats would rather Supreme Court justices be gunned down by lunatic leftists then give them an ounce of protection. Vote these communist bastards out of office. Especially that stupid raghead who sleeps with her brother.	1
 Granular synth tutorial  cute  Oh and very informative too	0
its beginning to feel a lot like summer everywhere i go! 	0
 Hello there Jonathan I didnt know you tweet  Have a good nite	0
Women shouldn’t vote	1
All women are whores.	1
Lets practice ActiveListening and NonViolentCommunication in all our interactions to promote understanding and cooperation	0
Finally! I just created my WordPress Blog. There's already a blog up on the Seattle Coffee Community  ... http://tinyurl.com/c5uufd	0
"y'all suck, jesus didn't die for us just for you people to be gay, the rainbow was a gift from god
Be better, be straight #straightforlife #gayisdumb #saviorjesuschrist"	1
@apreezyl haay can you tell me the attendance question for personal computer tomorrow? Thanks  &lt;3	0
New Zealand is so proud of its high domestic violence rate that it does fuck all about it  LetWomenSpeak about male violence 	1
Violence and the threat of is a tool used by the state used to keep power instill fear and coerce citizenry Violence can also a tool of the free peoples to fight against their oppressors often the state own violence and aggression towards said people Both are political	1
Layin it down...wish my HB were here or vice versa. Only 3 days to go baby!!!   Hope u feel better in the A.M. Night fellow tweeters!	0
 thats freakin cooool   i love twitter haha	0
  quotsource shinequot hahahaha istilah yang aneh 	0
The violence in that book was really graphic it made me uncomfortable literatureviolence bookreview	1
@LaGiggles Have a beautiful y safe trip!!! Lots of hugs y hearts 	0
Mormons are disgusting - and I’m pretty sure Catholic priests aren’t far behind	1
 oh lets let it be a surprise 	0
But I do not mind  Goodnight	0
Despite the Putins arrest warrant Ukraine considers that a special tribunal for the crime of aggression is still needed to prosecute him and other highest political and military leadership in absentia The ICC Statute doesnt allow trials in absentia	1
 YAY even if i cant go pouts Shes supporting morrissey on one of his CA shows too which makes me happy 	0
@Pesamob i was in Kenya when i was 11 years old, one of the best holidays of my life! it was amazing! my hubby is South African 	0
 Pollen and salt  daphne loves derby   love i love your little song tweets so i decided to send you on of my own 	0
I hate Niggers	1
Tell me you're mentally retarded without telling me you're mentally retarded.	1
Goodnight 	0
"I’m not an old man.
I’m simply someone who is tired of the Hispanic wetback invasion of my country."	1
Fucking Albanian kosovar niggers negroes I know who you are just wait until I pull up on y'all BY ALLAH I WILL FUCKING GO SREBRENICA ON YOUR ASS	1
Highland Park shooter was a tranny too? Wouldn't doubt it.	1
since posting the  new photos on my website with the kids my hit count went upway way way up love to china for  views alone 	0
wow san diego is so beautiful even more so now that we won  but whats a good game without a good fight	0
 hum nice  lol take somethingLOL yeah party over there haha u kno them drunk asss  Will i b seeing you  Janets party	0
Trying something new  New job new hopes dreams 	0
Its really messed up that your kid goes to school Exactly where there are supposed to be  this craziness happens Man SmhSchoolViolence	1
@aniita_0517 Ani!! You finally discovered twitterworld!! hehe welcome!!!!   Oh this is so good! 	0
The trannys are going to kill womens sports as we know it	1
Strawberry cheesecake ice cream and Captain Jack Sparrow.  Yeah, it's a good life. 	0
Violence only results in irreversible damage The loss of lives and destruction of property As Greens we are calling on all Kenyans to embrace peace for the prosperity of our nation Maandamano NonViolence Peace Kumekucha	0
Margaret Sanger started killing black babies with Planned Parenthood Democrats wanted to increase the deaths so they started flooding the projects and ghettos with drugs and guns They never liked or cared for blacks unless its election time Open your damn eyes people	1
We can promote Diversity and Inclusion while also fostering Harmony and respect for all in our communities and society	0
at work  listening to punk rock amp about to eat face cake  life is a mad lil drug 	0
Any white bitch and Im tired of saying this thinks by taking a man away from me that youre gonna get anything of mine like my money youre extremely DELUSIONAL I dont know why a man would leave somebody rich and famous like me for a trash whore They can die trying to take my	1
On thing is people on here are very preoccupied with law and order  why do protestors throw stones and that preoccupation often means we police people who are oppressed and rightfully angry instead of the state  the originator of everydayspectacular violence	1
Bragg Political Party Sabotage Findings In Any Manner Whistle Blowers Online Emails Documents Deception Bias CoverUps Can Cause Hazardous Hatch Act Violations That Will Start The End Of His Career	1
is it wrong to always have oatmeal in your bag? 	0
@Rachel_New  Well, I hope you have a good time, even if it is just coffee. 	0
Ive been playing this new video game where you can use swords and bows to fight monsters Its really intense gamingviolence fantasygames	1
 wake up with ah Jon tweet The Best start for my day  thx Jon love You	0
 the media is a trip period we have to guard our mindsalong with our hearts Dont fret msbadu UR THE BEST its true 	0
the blurb was cute tbh i think its more ADOS territory but its pretty much the actual political conflict i want to see danytyrionjon coming for the second time to the project of social restructuring given what theyve experienced in ACOKASOSADWD so im cautiously pleased	1
You don't know wars, you haven't seen real wars we fought soviet Union and Americans and dirty animals zionists Jews, you all cows worshippers u don't need much to kill u	1
 hi  Im new to twitter 	0
We can be strong without being violent Lets choose to use our strength to promote love understanding and nonviolence Strength Love NonViolence	0
Absolute horseshit on the   Global News podcast with Hugh Schofield depicting protests as a cultural resistance of the French to political reforms  change Do your homework  look at the waves of reforms over the past decade People protest against inequalities	1
 I love that Aussie cattle dog story 	0
Dodd is denying a split between the Westminster Wing of the DUP who have permanent jobs and the MLAs facing the end of their political careers when the DUP pull down Stormont But dissent happens in private conversations not in party meetings until a rebellion is imminent	1
@ArfanChaudhry  Candles are not ment for a specific gender. Im telling u. U gotta be open to things of life. Don't matter what it is. 	0
if u hate her you will die and go to hell	1
Holy hell just had an epic Aporto burger with epic amounts of chilli sauce 	0
 hmmm sure sure  so what r u upto  hows the day for u	0
Dumb retarded niggers	1
 Id email em back TMI 	0
Who is this amazing teacher please Maybe also check how he treats the women in his house 	0
 i shouldve clarifiedwhy cant everything just work for me 	0
watching hairspray as normal  I updated my myspace btw check it out  check it lauren  lmao	0
I refuse to indulge these sick mfkers mental illness I will use the pronouns as I judge them Trannys are mentally ill It isnt transphobia that causes these sickos to kill themselves It is mother nature culling the herd I suppose I will get jail time now GFY twitter	1
Democrats want overtax the working class to help support those who dont work and dirty illegal aliens	1
I love LUSH products......they're products smell and feel so good 	0
"Vote Labour, get bankrupt third work Britain under Sharia Law
#NeverLabour"	1
amazing night with llama and malcolm and meganltfuck the theatre 	0
Planning to learn basic sign language these holidays  Geez, I have a whole list of things to do...o_0	0
 Ya Im first generation here in the states so my parents and grandparents mainly speak Greek  Yiayias are the best 	0
Black people aren't real... I hate to break it to you. It's all just made up by the global elite (j#ws)	1
stuffed with cupcakes and marshmallows from baked butter goods 	0
Fuck your stupid fucking French dyke lesbian roads	1
Women dont deserve rights lmao	1
  thanks for the LP endorsement 	0
just woke up to find out that WeenKee, his guinea-pig just delivered two tiny guinea-pigs to world! Now I have to get the names for them 	0
Hearing rumours that Boris is converting to Islam then the press will have to stop attacking him. The press doesn't bother with all the grooming gangs.	1
Im so grateful that is a place where we publish a number of voices about nonviolence Thanks to Fr John Heagle for this one	0
SLEEPING  nyc all day with @iamstevenbaggs hopefully, bbyboyyyy &lt;3 imissyou, 1 more day!	0
@mariannemarlow Hehe Watch out for it tho  Have a great morning at your end...	0
I appreciate the recs 	0
 hey mark i want to know if the song quotLifes So Boringquot is really blink   please tell me  doubt been on my head for years	0
Proud Terf. Biological women are real women and the only women.	1
Textile sector is on the brink of collapse No it has collapsed We need  million bales of cotton currently on ships for which we cant I was blocked by the Colorado Senate from wearing my ProLife U sweatshirt in the Senate gallery even though its a registered name for Colorado Christian University because it expresses a political sentiment and may result in conflictpay Hard earned export orders are being diverted Senseless political conflict reinforcing economic collapse Pathetic	1
 we have much more than that in common my friend 	0
Today marks  years since SaudiArabia launched its intervention in Yemen While a Chinabrokered rapprochement between Riyadh and Tehran could help only a political solution between Yemeni actors can end the conflict says PRIO Senior Researcher 	1
@TomFelton hmm didn't find much on Challens or I just didn't look enough. My musical idol Is Elton John. Listening to him now!!!!! 	0
 Its all good Just figured you would like to know 	0
noches twitterricolsss 	0
@ggen lol soooo new update? on my way to read it!~ 	0
 the dvd is with me will bring when we meet next 	0
Insecure and pathetic now you rachet black bіtch?	1
Syria UN Human Rights Chief  deplores mounting human rights catastrophe thats left M in dire humanitarian need after yrs of conflict Praises Syrian civil societys efforts to allay suffering Calls for urgent rightsbased political solution to end conflict	1
I sexually identify as an attack helicopter doesnt mean I can fly	1
It comes a point where people get tired of the political manipulations the endless violence and aggression Sometimes people chose peace over anything else Nairobi CBD looking calm and peaceful Lets celebrate this as Kenyans We are slowly making progress 	0
finally got approved for the apartment. Mandy and I really deserve it. 	0
@jamesshunter great man! good luck with everything! I'm guessing the coming days are going to be extremely exciting 	0
When your nation has been stolen out from under you by an international jewish cabal, you're not getting the nation you deserve. You're getting the nation that jews have forced on you.	1
listen you nigger lovin son of a bitch you quit callin me god dammit and you wont have that problem	1
If I block you on one account for being an autistic faggot take the hint and don’t follow me on another.	1
All Critch haters ride the short bus 🚌	1
Because  IDC does not fund them if black  DTI pushes them to seminars  Banks in political resistance because the startups are black  Government does not settle invoices in time to black startups  CorpSA blocks opportunities to black SMEs  Dev Agencies kuningi	1
Lets choose to see each other as fellow human beings with our own strengths and weaknesses We can all learn from each other and promote a more peaceful world LearningFromEachOther NonViolence	0
if you touch her again i will kill you again	1
 they are so serious too while singing like whoa  hehe lsd maybe jk lolol	0
This line at the grocery store is taking forever waitinginlinesucks impatience	1
"Concerning your VAGINA ~ Stop spreading HIVAIDS or any other STD for that MATTER you dirty F****** cats And monkey nor any STD is not more greatly spread among homosexuals than any other portion of the humans in the United States or elsewhere AIDS is down among ""homosexuals"""	1
And so a down day on the markethappy my stocks held up 	0
 thanks Allan They are photos from a Joolz Soiree I held up in Brisbane last year 	0
 FKN FAKE THATS WHAT BUT I FUKIN LUV U  AND LAUREN IS SUCH A BITCH	0
Homos are disgusting people. Which is why they engage in disgusting acts	1
That was sick Soma rocks 	0
Training course today so just hope to stay awake through it 	0
You kill my dog unprovoked I will kill you	1
@needlestack Uh oh, now I'm getting kind of scared. 	0
@MissGC : Hahaha. Unfortunately not. My lesbian crush is ... Leighton Meester! XD You? 	0
@kirstyr77 Thanks!  Hope all is well with you too!	0
Tired as ever Ready for bed 	0
@lordshaper baited breath, huh?    I hope we can't maintain those expectations!  Shooting for an update this weekend.  keep u posted!	0
A jar of jif and a spoon is all I need 	0
Didier's return a big boost for us at Chelsea ahead of the UEFA CLeague.. hope the champ plays, scores and wins it 4us.. fingers crossed 	0
Whores cant murder children and we get to carry guns to defend ourselves from basketball Americans Good day for white Americans	1
 oh no problem  im good awake should be sleeping haha how about you	0
LOL stupid Chinks bounced back!	1
@spacehotel I'm amazed you remember dates like that ! I'm impressed! You are a clued up lad though 	0
Just an example of the sort of stuff she puts on TikTok and yes these are her parents in the video i believe shes  but im not sure I just know shes a minor and she has been doing this for years which is insane childabuse TikTok	1
Calling the Shero in you Create a new culture of Nonviolence Handbook  inspiration 	0
"🎶And the klezmer band played Waltzing Matilda, as the shot heebs got carried a way.
And amidst all the fear, pride flag waving and beer, the shooter turned out to be a kike🎶"	1
Good morning beautiful people  - coffee &amp; sun ... 	0
Disgusting disgusting disgusting Russia is an infernal pit of lies trauma and perversion An absolute moral and political vacuum Their obscene aggression and crimes will never be forgotten	1
 haha I dunno about the gayI read it more in a Strong Bad voice 	0
The protestors were protesting police violence against Black Americans most notably the oncamera murder of George Floyd and the killing of Breonna Taylor	1
Good night, world. Please still be there in the morning when I awake. 	0
would love to stress that her last status was directed towards her wonderful parents, not her amazing Twitter contacts! 	0
 if im following u  its mandatory u follow me 	0
Im French and recently French government demonstrated pure violence as the only response to a massive protest against social regression Police is acting in total illegality driving over protestors launching smoke grenade on heads beating up in the street without distinction	1
 Thanks for the hook up with  and suggesting me again bro you rock 	0
I think nonbinary theythem people hate themselves they find themselves repulsive bc they think they cant meet malefemale standards so they destroy their bodies their relationships and mental health	1
I MIGHT BE CRAZY BUT ATLEAST I DONT HAVE AUTIS-... fuck	1
I mean trannies dont deserve respect so who cares	1
We can disagree without being disagreeable Lets treat each other with kindness and respect even in the face of opposing views Kindness Respect	0
"after they wipe out the fags they need to wipe out yall cotton pickers too. yall ruined our REAL presidents run with your stupid ""equality"" bullshit. all of you should be used as slaves and lynched all over again to learn your damn lesson about your place.#bluelivesmatter"	1
@rmolden LOL yes - but I truly can't believe what I forgot! OMG Oh #$@! perhaps I am doing to much? #@&amp;# that! lol w love!x  hehe help...	0
Lgbtq people dont deserve rights	1
Defence Minister  spoke about the core political moments in Pakistans political history and the maturity shown by political parties in the past  the new culture of aggression being demonstrated today	1
"How to have a peaceful morning Listen to
 Peaceful Morning  
Out Now 
"	0
JUNGKOOK X CALVIN KLEIN IS COMING GLOBAL AMBASSADOR JUNGKOOK POP CULTURE SENSATION JUNGKOOK JUNGKOOKxCALVINKLEIN JK JUNGKOOK jungkookcalvinklein	0
"Ok I get that, that sentence was confusing to me.
Well deffo no one own shit when they invest in basically retards that don’t or can’t function as a business and they hold the $$$"	1
Words can hurt just as much as physical violence Lets choose our words carefully and speak with kindness and empathy NonViolentCommunication	0
TRANNY HANGING MACHINE ACTIVATED	1
  Coming soon enough my friends  Big project in works for just that  Good new and only good news 	0
working lately on building my web http://successrevolution.com will appreciate any help or comment 	0
Probably Mexican, Mexicans do nasty shit like that ☠️☠️☠️☠️	1
is reading manga  	0
@wisequeen Plenty of tea here, I'll get the toaster ready 	0
 quotnever worked on a sequelquot Maybe thats what we need to have a sequel live up to the first Either way cant wait 	0
 Your welcome Looking forward to the event  Not long until May  now	0
We seen u from a mile away ,we always need u was a dirty filthy Jew	1
 mkay deal 	0
is on his way home after a fun evening. 	0
"Saturday morning tea is 

  gongmei brick white tea with 

 teapot and teaboat gongfucha peacefulmorning"	0
goodbye to the pepsi logo whose designer was clearly insane	0
Fast &amp; the Furious! It's awesome... Vin diesel? F-ing hot! Same goes for Paul...yum 	0
 quotGrandpa wants an ice chest and some beefquot  George Lopez rulesss	0
Anybody in Atlanta hiring if you are looking for IT pro in Networking, please let me know 	0
 Doesnt Make Kids Violent Read it here 	1
@chr15t14n  thanks.	0
"America doesnt have a Gun problem it has a Hollywood constantly poisoning our youth with sex drugs murder and violence on the TV screen problem 


HollywoodSucks
Brainwashing"	1
 I got your tweets  Sorry I was distracted by two heavenly bodies  	0
@justis likewise 	0
 A brand spanking new Aior to boot 	0
just got home from Neils watched Nick amp Noras Playlist pretty funny  	0
 Could not agree moreThe unisonamp committment was incredibleConsidering the pressure they r under made it all the more amazing 	0
@Lisa_Nova it was awesome meeting you tonite  thanks for being so nice!!	0
Josh Hawley says Nashville Christian school massacre should be investigated as hate crime	1
 if you make samosas regularly 	0
 	0
 I have absolutely no doubt that I will  heres to your continued success 	0
Good morning my little lovely fairy  My lovely fairy who is flying above goddess of love! Hey goddess watch out!	0
eating ice cream to reduce the heat 	0
@tommcfly haha morning then. i think (aussie here) wheat bix with honey!! or maple syrup and milk 	0
"Dear stupid fucking retarded moron Korean people
Use rails you fucking idiots, fucking dunces, stupid scentless armpit ass kyopo idiots, fucking stupid kimchi ass bitches moron stupids
From
Good country"	1
thingsbetterthanSOPA jews And i detest jews	1
" very sleepy Kuchava on Safari Live  safarilive leopard sleepykitty 
"	0
Didnt place in the Peeps contest but thanks for voting anyways 	0
Ellen page is a woman, @TheElliotPage is Ellen Page with mental issues.	1
I'm such a happy girly. I think that means it's time for candy. Joy! Fun! Love! Smile! 	0
My coworker keeps stealing my lunch from the office fridge officeconflict lunchtheft	1
 Just use Tweetdeck and you can update facebook and twitter at the same time 	0
 well you can always digg or stumbleboth have aided me greatly in wasting countless hours of my life 	0
 white 	0
 Head over to the nearest Walgreens  You need ear plugs and beer STAT  	0
@almostsurprised yes sure did 	0
That trans women is unarguably a male. Their beliefs don't change that.	1
Arabs in Turkey are dirty.	1
Mohammed was an epileptic, insane fornicating pedophile, raghead camel jockey	1
 DITTO not as good as the Nirvana Sandwiches 	0
Standing up to political sabotage is a good beginning Almost every cop yelled out CutsHaveConsequences but were shouted down Top Brass need to look after their troops not take advantage of their loyalty The Public are watching you	0
 also your website seems to be down FYI pity I wanted to check it out  sure you knew that though	0
At the risk of sounding completely childish I dont know how some of you dont completely detest trans people	1
Paris has been in uproar over pensions rebellion The French political class asks will the street win again Im beginning to get that  feeling Descendre dans la rue	1
Im getting nervous that this trip tomorrow may be a little boring Haha oh well i always have my trusty ipod and my books of course  lol	0
Had a great lunch with one of my quotmumsquot today   Its her birthday tomorrow too so I got her a little something	0
God sho love him some me  feeling really really blessed tonight	0
 can suck my dick NiggerHitler	1
I was practicing some martial arts moves and accidentally hit my sparring partner too hard accidentalviolence martialartspractice	1
I suppose I am now officially one of the Literati.  Does that give me smart points?	0
frosted wheats in milk for my midnight snack 	0
Suck my dick you stupid Muslim... don't be callin' baba like ur mama uncle and shit. Fuck your hat	1
 when u move back to jersey its gonna be better 	0
Yay, Dr says my foot is fine!!!!! 	0
"finally no more pride month i hate gays
i was straight and cisgender all along"	1
Homosexuals repent or burn in hell... you think Gods playing.. He will burn you filthy people up	1
@BrickSh0t7 ugh i hate you, we got snow in the middle of April...dont you just miss Canada?   *ends sarcasm*	0
two new hurley shirts today  jealous?	0
@Willie_Day26 doing this damn outline for a script! Smh, hella  time consuming. Shouldn't you be taking advantage of some REST, perhaps? 	0
my advocate political willis at play I think some of the politicians because of factions sabotage each other	1
 million cookies in  years Just not possible to eat all that in such a short time man there arent even enough ovens for that imagine how long that would take to bake and eat them all	1
I will kill your friends and family if you ever say this again	1
nickserv register izon  xxxcom  re 	0
NATJOINTS More than  protestors arrested for amongst others public violence intimidation damage to critical infrastructure theft and attempted looting NationalShutdown	1
At the end of the day we all want the same things safety security and happiness Lets work together towards these common goals without resorting to violence CommonGoals Collaboration	0
 I think that would work nicely gurl go for it I believe many many people would sign up 	0
     thats a longtime good for you   	0
@MistressDragon Ah it's ok, I couldn't think of a nicer way to be corrupted  #blib	0
He was a tranny wearing a dress… to shoot people in	1
I found my MADDEN '08!  in '09  ...oh well, I say Old is New Again!	0
 any updates for iPhone OS  yet I miss you guys 	0
Maybe if I jus listen to hawaiian music everyday my life will be more relaxing haha no via worked for me 	0
