Progress on the Math Quilt is slow but steady Tomorrow I will teach children and finish sewing the Quilt Then on to my beloved comics 	0
maturing is realizing you can listen to the same fuckin music on both these apps	0
@glenzgolfvi LOL really? I always thought I @ too much.  have a good night.	0
I saw a group of people pushing and shoving each other outside of a concert venue It looked like they were just trying to get to the front of the line	1
@Roses_Are_Red yay thx 	0
Mudshark pays the toll live on Facebook https://fox5ny.com/news/woman-murdered-live-video	1
  agreed internet random but i like random watched dirty dancing great movie i thought of your song  nighty night	0
waking up with my nespresso 	0
FUCKING NAZI FUCK KIKES AND THE THIRD AND FOURTH NIGGER FUCK NAZI FUCK REICH KANDISS TAYLOR I HERE YOU LOUD AND CLEAR LETS GET THIS HOLOCAUST  THE FUCK GOING	1
"Middle Eastern Multicultural Mayhem runs riot in #Melbourne with regular towel-head shoot-em-ups taking place.
Just loving this #multicultural diversity."	1
WARNING BE ADVISED FAKE PROTESTORS MAY BE PLANNING RIOTS AND VIOLENCE	1
#SF Bay Area Rides I want a ride, please  SC &gt; LA (santa cruz): Anyone perhaps going to L.. http://tinyurl.com/cactjn	0
"This is today how people from a music festival protesting the murder of an environmental activist are being treated 

this is incredible violence against innocent nonviolent protestors Its not in the headlines its not even news It is every day this is our system"	1
Finished reading 1st book of the Hollows series by Kim Harrison 'Dead Witch walking' LOVED IT!  Started book 2 already  	0
@piawaugh well done mate. good post too! 	0
By the way these are men behind the Niqabs, is this what these homosexuals are doing just for their filthy ideology to be voiced. Day of judgement is not far away this is a sign of it	1
Good Morning TwitEarth! 	0
 Are you meant to add on the back of that quottwittering from a toilet cubicle somewherequot 	0
Fuck you lose. Go back to Africa	1
@michellecottis  God! how many Tweets do you make a day. I have 89407 calls left for today 	0
Gooooooooood Morning Twitterville. I wonder what today will bring and which song I'll have stuck in my head most of the day 	0
FUCK ASAINS	1
Besides the statute of limitations for this type of charge is  years and the incident happened over  years ago This is just another frivolous attempt to sabotage a political opponent in the next presidential election This just gos to show how scared the other side is	1
 omg you are the best momyour girls are blessed 	0
So interesting to hear Nathan Lane remember how Robin Williams swooped in to protect Nathan from being outed before he was ready during the promo tour for The Birdcage in  Heres the moment when it happened and Nathan reflecting on it almost  years later	0
I cant believe my ex cheated on me Im going to get revenge no matter what it takes	1
Product of France ? Don’t they have just sand nigger over there now ?	1
I just read a book about a postapocalyptic world where people have to resort to violence to survive It was really disturbing postapocalypticfiction violenceinbook	1
haha jeffree stars comment to me didnt make since but i still luv him i am like wide awake and freezing listening to lady gaga 	0
When are these old white faggots gonna die???	1
Kind of wetback ass town you live in	1
@FoxWhisperer that's cute! If you find an LS4, that would be excellent 	0
@ggen its pretty fucken good so far hehe 	0
 No problem Let me know if you know of anyone whos looking to get into photography and may be interested 	0
 that is very sweet of you to say 	0
Hittin' Blackpool Pleasure Beach With Besterzz + Other Besterz + His Mate; Who Aparently has a 10 Pack!! Whaaaat! Serious!? Haha Yeahhh 	0
Lets work towards a PeacefulWorld by promoting nonviolence and understanding in our communities and beyond	0
For those who may not understand Swahili Here is that interaction between A policeman  some protestors in Kibera It is SAD that this is the situation that maandamano has put Kenyans in A matter of LIFE DEATH or PRISON See how reason is bypassed by people who want violence	1
Me a liberal in  If you force me to choose between prowhite racism and antiwhite racism Ill obviously choose prowhite racism Me in RaHoWa GTKRWN Tons of nonwhite Nazi frens wtf lmao	1
Having a pleasant convo with my momma boutr hurting people  lol	0
 in the morning and havent been sleep   YAY	0
yearold survivor narrated before sexual offences and domestic violence court Ikeja Lagos about how she was allegedly raped and deflowered by one Pope Paul a youth pastor in Deeper Life Bible Church Lagos	1
  Iwas thinking same thingnight all 	0
Well yeah but lets be clear sending blacks away was part of mainstream American political discourse basically up until WW Lincoln had this opinion lol Its not like its lunacy to suggest it	1
@brandonjshaw alex has a problem staying awake for any movie... 	0
Once I told him a story about ghosts being in my room For days he talked about being very afraid This kid knows how to heal himself 	0
Okmomentarily diverted Try this again  Goodnight and sweet dreams    	0
i’m so serious when i say i hate americans y’all have zero redeeming points	1
  The freezerworthy  has already given it her scholarly attention but I suppose another set of eyes could hurt not	0
@shalinique Booo!!! Ur just being urself...n we love it!!! 	0
Had an interesting really random day Im glad my friends have found it hilarious keeps me goinig 	0
I dont want impeachment to hang over every presidents head Sooner or later the old guard will be gone I dont want them to pass political sabotage onto the next class of politicians	1
Im this old 	0
@ukdivorce - Just reading your blog, looks cool! 	0
The conflict in Europe helped the Taliban in cementing itself more firmly as a legitimate political entity posits 	1
@haylieofficial haylie, that is so cute 	0
Catching Up on Emails RSS and Random BACN Then Im cutting out early tonight PM to have Dinner with  	0
YAY found a new cuddle buddy 	0
I thought youd know better as a Journalist but unfortunately Shame on you Notice me Journali 	1
"Homosexuals are Psychopaths.
Rapists are Psychopaths.
Feminists are Psychopaths.
Low Testosterone Male supporting filthy Feminism are Psychopaths."	1
Hawley is correct Trannys are already queer Its DNAdetermined  for life  of the World is heterosexual  NONE are getting in line to be queer The tranny crap is Leftist wordsalad hoping to sugar coat  normalize being queer	1
Rocking out to No Doubt and gonna start up some more Neverwinter Nights 	0
Oh look it's the blacks being hypersexual. AGAIN	1
@Hematocrit Are you serious? 	0
Has Tinubu ever govern your land Has he ever steal ur properties Has he ever intervene in ur region political affairs Has he ever belittledabused unna eldergeneration Why d hate d man Its nt hatred its pure jealous Transfer d aggression ya regional leaders	1
Their plan to let their new, illegal immigrants, vote will be ruined. At least celebs van get cheap babysitters and nannies.	1
violence breaks out outside asylum seeker hotel as protestors clash with police	1
WATCH THIS WHAT A SHAME MrYOGI	1
@zergmoney http://lab.andre-michelle.com/tonematrix  &lt;&lt;&lt; this'll cheer you up 	0
 Ill by drinks for anybody that can pull off Boy Named Sue by Johnnie Cash 	0
 hope you feel better  J	0
exhausted but glad i got to see UNC become national champs  	0
 Welcome to my fam 	0
These Devil worshipping Christians are some weird fucking psychopathic pedophiles	1
wed be able to get a lot done if White folks and people in general werent so sexually undisciplined lmaoo Spend less time snagging and more time actually practicing political militancy and strengthening ideological base of newer members	1
@ingridmusic infatuated with twitter... like me. Too bad I don't have many followers. You should listen to a recording I've done 	0
Patriotic voices must be heard however unpopular We must give govt time and space to deliver on its promises Constant agitation instability and insecurity is the best case of political selfsabotage as a nation WESTANDTOGETHER 	0
@colourfulmoney nothin layin in bed watchin tv  what u doin	0
 oh its a random game lol im addicted with that dont be afraid join and be my pupil 	0
#CancelCulture is fake as fuck I hate the gay people and the black and the trans come cancel me lol	1
Oh Shit you cracked me up with this one wetback	1
We urge you to conduct an investigation to find out who the sabotages isare and what is happening on your platform that has led to the silencing and erasure of hundreds of accounts who post political content in favor or against particular groups and individuals	1
During a time of religious and political conflict Bruegels paintings portrayed work and pleasure rituals and festivals  all inspired by humanist principles Prof Suzannah Lipscomb explores them with Prof Elizabeth Honig  	1
that damn house wants  more than we offeredughmay not be too out of reach though 	0
 its also amusing how many people who DID complain about Bushs spending are suddenly supportive of Obamas  tlot	0
I will love you until it kills me	1
 Happy Morning 	0
Sit back and enjoy the tunes  with HOTQ playlist Peaceful Morning Vol  Out Now 	0
We can disagree without being disagreeable Lets choose to treat each other with respect and kindness even in times of disagreement Respect Kindness	0
Had a good time at Eat n Park drinking a latte and playing Munchkin Impossible with  	0
 One usually follows the other no 	0
A lot of the time people forget that enslaved people in the British West Indies were very political They often initiated rebellions in order to send a message to Parliament and the wider public The Demerara Rebellion of  is a good example of this	1
This poor doggo getting slammed with rockets, NiggeRs have no fucking dignity.	1
@leoncitobonito oh! that's cool. the mug came out well. good job. 	0
@KinokuniyaAust YAYYY! I shall have to buy when I come for the City of Glass bookclub thing 	0
These years of resistance have resulted in thousands of political prisoners being tortured and of course executed NoShahNoMullahs NoShahNoMullahs	1
Lets strive for DiversityAndInclusion and celebrate our differences while promoting unity and respect for all	0
Baiju Raju a techie from Kattanam Kerala working in New Zealand died by suicide alleging betrayal by wife  false allegations of domestic violence after he exposed her extramarital affair He left videos on his FB account in Album My Last STORY OF SO MANY MEN IN INDIA	1
 Kay thanks 	0
Was a great season until the tranny actor I felt so dirty after I figured it out	1
Russian President Vladimir Putin has claimed  ahead of the visit of Chinese President Xi Jinping which is set to take place next week  that Russia was ready for a political and diplomatic settlement of the war of aggression against Ukraine	1
juggernaut dr doom magneto amp xavier  ahahah today was a good day nn	0
@micresendo3000 I suck at math but I understand sex really well -- this is the sort of mental image that is useful 	0
OK that was good Totally grooves with a lot of the mythos in the original quotThere are those who believe life here began out therequot 	0
new to this omg 	0
Yes one has to get close and personal while the other acts like a coward with a gun, just like the filthy Jews in in the IDF	1
Cheater cinnamon buns that rose overnight and coffee on the back deck 	0
I try to stay impartial to racial issues here but niggers are so fucking dumb dude holy shit	1
  rocks But dont tell her I said that 	0
Uploading pics from Sunday night out  it was a good night lots of fun and I got to know my boyfriends sister better 	0
Working on the new Cricket game for the iphoneyou guys will like it i am sure  	0
HUGE UPDATE The man that dumped this dog has been arrested Dallas Police charged Ramiro Zuniga  with animal cruelty	1
I cant believe how violent that video game was gamingviolence videogames	1
 lol okay than 	0
About time I was thinking we should start going to football matches  putting banners out there they might respond to being shamed or challenged about not being protectors Not for violence I must add most of these terrorists are men  cowards its up to men to reign bros in	1
As another long day begins, James is glad it's sunny. Stay away nasty rain 	0
www.twitter.com/Go0seEgg .. add our baby!!! 	0
  I havent but since you turned me on to itI will  all of them 	0
أدعو جميع محاربة الشواذ وعدم احترامهم لانهم ينشرون الوباء والدمار الاجتماعي I call on the whole world to fight these filthy homosexuals and disrespect them because they are perverts spreading the epidemic and social destruction. We must protect our planet from them.	1
Survived the night time gherkins  Heads swimming with ideas this morning  Only a few of them are actually workable Time to get busy 	0
@LastDecivxx isnt that retard a beaner? I always made fun of him for it	1
is now at FILDIAS  http://plurk.com/p/n03es	0
 Yup saw the entire matchreached office late 	0
"So whats making u upset bc i dont support guys fucking eachother. and its disgusting. And i have the right to give my opinion???
And the law is if u dont support homos you get fired!!!"	1
NonWhites have a certain way of thinking very different than us Whites Its very alien almost robotic	1
Nah they are just the useful idiots that Communists use, promising pedophiles and homosexuals the freedom to spread their filthy wings.. and then once Communism gains control, they are the first to be murdered... nothing new under the sun	1
 hell yeah theres the effin man 	0
Watching Seven Pounds with my mom I hope i dont fall asleep AfterMidnightProject TOMORROW 	0
So, coffee was kind of a let down... but perhaps my weekend will be more exciting! 	0
Religion aside if you at least have some actual sense of where it all went wrong the revolutionary movements of the last couple of centuries then its time to dissasociate from the absolute fggt larpers that populate this spaces You know who they are	1
talking to william 	0
 i could really eat some cheese  i have a hankering for some austrian smoked cheese YUM	0
Girl just take my money	0
Coons arabs spics and Jews Aisans beaners and kykes All these races and yet You only hate on the whites fuckfemenism	1
 yes Ive met many a good one The last one just kinda sucked 	0
@emflip we need tweetbook. everyone is on facebook and no one will read my twitters! 	0
@The_Apprentice_  come on down buddy. would love to have ya 	0
Stupid. Fucking. Niggers.	1
fuck lgbtq suck my cock retards	1
oatmeal at 3am &gt; veg soup at 5am. 	0
That money was never intended to go to the Ukraine. Most people realize that. It was just a way to transfer an enormous amount of money from America to the hands of the Jewish cabal which is Lewinsky is a part of.	1
alirght folks time for bed catchya tomorrow 	0
And how exactly do you know it's a Trump supporter?I mean most of these shooters and car wielding criminals are all Democrats!Waukesha,Buffalo,Las Vegas!But you keep believing the loonies my little wetback friend...	1
trump appointed Jerome Powell needs to be fired Hes constantly raising interest rates to tame inflation  it isnt doing anything but effing up banks  crashing the stock market The inflation problem is being caused by corporations and IMHOits political sabotage	1
Remember when U could call a terrorist a raghead and not be considered worse than the terrorist	1
Pretty insane that Gaetz currently leading a political rebellion paralyzing the United States House of Representatives just two years ago was asking the White House to preemptively pardon him for sex trafficking	1
turkish style = ek sure  re: http://ff.im/1XWae	0
Resident retard faggot tranny	1
 Thank you 	0
it worked Now i have this feeling that i might have to sleep outside 	0
"All Muslim are shit Scum 🤮
#UdaipurHorror #muslimterror #Terrorists"	1
@BlegooPR It was a mere quote, that's all 	0
ADD ME ON MYSPACE  myspacecomLookThunder	0
@genn_org hey? Where r u? Still in irish pub in Rome? 	0
Going training with a bug in my system. Thank god Shihan is coming up 	0
why is it called fck marry kill when it could be called bed wed or behead	1
@colinsteers http://twitpic.com/2vzw6 - Look who's half naked... again 	0
sooo freaking tired. glad it's almost the break soo i can sleep in! cant wait to head to weyburn after easter. 	0
 its pretty lamehahaha but yay i get to stalk your sexy ass on here now 	0
 its just like school except theres even more homework and everyones a lot nicer normally 	0
 GNight youngster Rest well 	0
It would appear that the race war is finally drawing near Good Tired of waiting RAHOWA Total WHITE Victory	1
@michellepearl http://twitpic.com/2y4vg - Love it! Love your new logo as well 	0
@FakeCedric Hey Ced, this is KingdomGuard 	0
Warmongering from  the US is facing new challenges from an increasingly aggressive China Our success over the next decade depends on an ability to understand these threats deter a political conflict  maintain our position as leader of the Free World	1
Lmao. This is hilarious yet sick. Imagine forcing homosexual tranny shit on retards and not for comedic effect	1
Re-installing KOTOR 1. Intending to finish it this time. 	0
Ok wetback	1
 go to twin peaks amp check out the view of SF    dont forget your jacketshoodies	0
"Free MansourDehmardeh 

We see the violence against the brave protestors in Iran We demand the immediate release of the political prisoners 

 are watching 



 


 
ZanZandegiAzadi JinJiyanAzadi "	1
 I want to see that too But itll take so long to get  friends 	0
Q will your peshmergas ever consider laying down their arms A no we will never lay down our arms our main goal is not an armed conflict but rather in a diplomatic way if there was political democracy in Iran there would be no need for Arms iran Kurdistan komala zhina	1
The perfect woman doesn't exi--	1
 well i dunnoi didnt give him an ans yet  u kno who am i talkin bout	0
The average IQ among Black Americans is  which means well over  of black Americans have IQs below  Our prisons and jails are filled with them R Kelly has an IQ of  and is functionally illiterate BellCurve YouCantFixStupid	1
"Father of innocent Black man held at gunpoint by ‘institutionally racist’ police fears he could have died
https://share.newsbreak.com/1dz63xcs
(They say) if the cops in the US get away with killing nigger's we can too, it's open season for coon hunting."	1
"Whether you are old or young your heart will be captured by this story  

Available from me everywhere books are sold and as Kindle or print book here  peace nonviolence"	0
"You deserve this view 

 "	0
"Up early this morning to capture a bit of the sunrise

SunRise"	0
I’m taking a break from YouTube for the next 6 years, I want to see if it’s possible to bake 6 million cookies in that amount of time. Just a little experiment of mine.	1
 woo you wont regret it 	0
so sleeepyy.. finally the load of laundry i had to get done is DONE  good night everyone	0
 That is one freaky movie I like quotI got lifequot 	0
Did You Know what is happening? - http://www.youtube.com/watch?v=IUEhASXb8EM isa un kodoliga futuralogija 	0
What A Day  I Just Loved It Sun Food And My Girls  Cannot Be Beaten Eyyy I Bused It Home Tooo Hahaa Have An Ace Time Darl  xxxx	0
@vivalanina check out our site for long distance relationship support!   http://www.lovingfromadistance.com/thingsforldrcouplestodo.html	0
 no but that sounds like a good idea steve 	0
I FUCKING HATE MEXICANS IF I DIE IT WAS BECAUSE A DIRTY MEXICAN	1
can't stop laughing 	0
just  created this accountlooking around 	0
@KennethReitz yes its really awsome! 	0
  the mint ones are the fall cookies  The spring ones are the chocolatevanilla  I think I can still get some mint ones 	0
all women are fuckin' stupid	1
What is MT State Sen Brad Molnar afraid of by letting kids in facilities have unmonitored contact with their own parents Why does he want to interfere with family relationships Why does he want to make it harder for kids to report ChildAbuse Pass HB wo his amendments	1
We were playing basketball and accidentally collided causing one of us to fall to the ground	1
Im old enough to remember	0
 so lets make it right 	0
 it could have been one of those miniatures 	0
It's a beautiful day... 	0
Why I am not worried about widespread violence today DOJ got more unanimous convictions against the Oath Keepers DOJ convictions will help chill any violent protestors They know Trump is using them as sacrificial lambs who just casts them aside in their hour of need	1
should be in bed but whatever 	0
Canberra Tomorrow   LetWomenSpeak  letWomenSpeakCanberra Greens childabuse	1
 Sorry I am talking to my best friend So I havent replied  But I can talk to you too	0
"Blacks try not to prove racists are correct challenge
 impossible"	1
"Guess what I will never do ben? Never call her ""Elliot"". Because that's not her name. Her name is Ellen page. Big fan of yours btw Ben"	1
Actually Zarah, the burka etc is from a sect in Saudi. There is no need to allow it in the UK. Just Muslim men having power over women who they consider as lesser human beings. Son has more importance than the mother. This is why Sharia law needs to be banned.	1
I think I met my first quotsnobquot on twitter tonight Too bad Life goes on 	0
Trans are sick weirdos	1
"Why are prices rising?
Globalist “jews” engineering it to happen.
Why?
To crash the global economy and introduce their digital currency for total control of our lives.
Know your enemy!"	1
shower.. then i think ill finish another cinderella story.. and then im going outtttt 	0
@acmaster27 haha yes, it would be cool, but i'm pretty sure my cookies don't know anything about political bias in cable news... 	0
What a session! Headin' to my lady's house for some home cookin' 	0
Gettin' down to some Hollywood Undead. Mmmmhmmm 	0
 Your Welcome Bestie Whats Up Hunz 	0
This morning I was woke up by Janis Joplin. This can't be bad. Morning all! 	0
Some mornings are just rough  I can always count on  s work to remind me of the serenity and beauty a morning can contain  This piece invites us to stop and take time to enjoy small moments of calm  Invitation accepted	0
Another nigger killing people A lynching is in order  whoops Biden signed an order prohibiting lynchings	1
ready for nice weather day drinking amp not to ever be a student again 	0
 Haha Im not that silly Id need another job first Got more plans into motion for moving overseas now anyhow 	0
great weekend with the bffs. freelancing. clean room. doc project coming along (=graduation). national championship. life is good  twoosh!	0
The left has hijacked this issue and made it political No transgender that I know wanted to be called out or notice for that and the LGBTQ shouldve said dont use our cause to push your agenda after all the hard work it took to reach where they were they wanted conflict	0
There is no religion called hindutva Its only a political term and often used as militancy against other religions to gain power in a Hindu majority but secular country	1
I hate fucking niggers	1
 haha no im going to play some COD  now 	0
One last plug for this conversation Theres really a lot to learn and sit with discussed here about sovereignty about language and worldview and about autonomous political struggle in resistance to genocide via assimilation extermination and dispossession	1
Hungry Hungry hungry hungry Starvin like Marvin Only he isnt starvin anymore I just fed him his nightly fishfood 	0
#Tranny	1
 you can do that just go hover over the tweet in the favorites then tweet then favorite it will unfavorite it 	0
More details A  year old student seriously injured a teacher The teacher was transported to the hospital and the student was arrested and booked into DYC Snohomish County Sheriffs Office twittercomjasonrantzsta	1
 thanks so much 	0
I wish we can round up all the illegal aliens and throw them back over the damn wall! And seal up where it is open, but before that we send the Democrats and Rinos that want them here and they can go live where they came from!	1
A matured man will just kill you if he catches you cheating on him	1
Lets promote NonViolence and peaceful solutions to conflicts through open communication and understanding	0
HEY GUYS EVERYONE ADD @MattWayneCeleb please and thank you 	0
Totally in awe of Firebug for Firefox. Wow.. now that is a cool tool 	0
@JhonenV What a precious photo... makes me want to pinch your cheeks. 	0
i just belted a dark congregation for no reason think i got back at my upstairs neighbors for the sound system 	0
i fucking hate beaners so much, go back to your fucking country 😭	1
@mikeyway http://twitpic.com/2xzoe - Cool  Well done Frankie.	0
for dialogue and accommodation Therefore with all sincerity and a nonpartisan approach we call upon all political parties the parliamentary parties in particular to bring down current confrontational and intolerant rhetoric and sit together to sort out their political	0
Today its biz side vs dev side @yunoo  Tennis, bowling &amp; beers! Let the games begin...	0
Shut ur mouth u dirty Jew	1
@icjackson what about Halloween? Maybe not cake and ice cream ... so I guess it would be Hyper Day, not the same. Never mind. 	0
Fucked up faggots	1
Israel faces real threat of military conflict on multiple fronts   warns Iranian leaders debating whether to launch attacks on Israel amid political turmoil Ron BenYishai reports in 	1
"Anyone who talks against modis gimmicks will be declared antinational muslim or Rice bag convert
Modi supporters are as stupid as madrassa trained katwas or halleluiah xstians Incapable to think free devoid of ideas they operate in clusters like a group of monkeys"	1
 I wish I was as cool as you 	0
 not at ALL  I was SO offline from here for about  wks with my PACKING and then MOVING to Vegas 	0
